<?xml version="1.0" encoding="UTF-8" ?>
<!--

       Copyright 2009-2012 the original author or authors.

       Licensed under the Apache License, Version 2.0 (the "License");
       you may not use this file except in compliance with the License.
       You may obtain a copy of the License at

          http://www.apache.org/licenses/LICENSE-2.0

       Unless required by applicable law or agreed to in writing, software
       distributed under the License is distributed on an "AS IS" BASIS,
       WITHOUT WARRANTIES OR CONDITIONS OF ANY KIND, either express or implied.
       See the License for the specific language governing permissions and
       limitations under the License.

-->

<!ELEMENT sqlMap (typeAlias* | cacheModel* | resultMap* | parameterMap* | sql* | statement* | insert* | update* | delete* | select* | procedure*)+>
<!ATTLIST sqlMap
xmlns:fo CDATA #IMPLIED
namespace CDATA #IMPLIED
>

<!ELEMENT parameterMap (parameter+)>
<!ATTLIST parameterMap
id CDATA #REQUIRED
class CDATA #REQUIRED
>
<!ELEMENT parameter EMPTY>
<!ATTLIST parameter
property CDATA #REQUIRED
javaType CDATA #IMPLIED
jdbcType CDATA #IMPLIED
typeName CDATA #IMPLIED
nullValue CDATA #IMPLIED
mode (IN | OUT | INOUT) #IMPLIED
typeHandler CDATA #IMPLIED
resultMap CDATA #IMPLIED
numericScale CDATA #IMPLIED
>
<!ELEMENT resultMap (result*, discriminator?)>
<!ATTLIST resultMap
id CDATA #REQUIRED
class CDATA #REQUIRED
extends CDATA #IMPLIED
xmlName CDATA #IMPLIED
groupBy CDATA #IMPLIED
>
<!ELEMENT result EMPTY>
<!ATTLIST result
property CDATA #REQUIRED
javaType CDATA #IMPLIED
column CDATA #IMPLIED
columnIndex CDATA #IMPLIED
jdbcType CDATA #IMPLIED
nullValue CDATA #IMPLIED
select CDATA #IMPLIED
resultMap CDATA #IMPLIED
typeHandler CDATA #IMPLIED
>
<!ELEMENT discriminator (subMap+)>
<!ATTLIST discriminator
javaType CDATA #REQUIRED
column CDATA #IMPLIED
columnIndex CDATA #IMPLIED
jdbcType CDATA #IMPLIED
nullValue CDATA #IMPLIED
typeHandler CDATA #IMPLIED
>
<!ELEMENT subMap EMPTY>
<!ATTLIST subMap
value CDATA #REQUIRED
resultMap CDATA #REQUIRED
>
<!ELEMENT cacheModel (flushInterval?, flushOnExecute*, property*)+>
<!ATTLIST cacheModel
id CDATA #REQUIRED
type CDATA #REQUIRED
readOnly (true | false) #IMPLIED
serialize (true | false) #IMPLIED
>
<!ELEMENT flushInterval EMPTY>
<!ATTLIST flushInterval
milliseconds CDATA #IMPLIED
seconds CDATA #IMPLIED
minutes CDATA #IMPLIED
hours CDATA #IMPLIED
>
<!ELEMENT flushOnExecute EMPTY>
<!ATTLIST flushOnExecute
statement CDATA #REQUIRED
>

<!ELEMENT property EMPTY>
<!ATTLIST property
name CDATA #REQUIRED
value CDATA #REQUIRED
>

<!ELEMENT typeAlias EMPTY>
<!ATTLIST typeAlias
alias CDATA #REQUIRED
type CDATA #REQUIRED
>

<!ELEMENT sql (#PCDATA | include | dynamic | iterate | isParameterPresent | isNotParameterPresent | isEmpty | isNotEmpty | isNotNull | isNull | isNotEqual | isEqual | isGreaterThan | isGreaterEqual | isLessThan | isLessEqual | isPropertyAvailable | isNotPropertyAvailable)*>
<!ATTLIST sql
id CDATA #REQUIRED
>

<!ELEMENT include EMPTY>
<!ATTLIST include
refid CDATA #REQUIRED
>

<!ELEMENT statement (#PCDATA | include | dynamic | iterate | isParameterPresent | isNotParameterPresent | isEmpty | isNotEmpty | isNotNull | isNull | isNotEqual | isEqual | isGreaterThan | isGreaterEqual | isLessThan | isLessEqual | isPropertyAvailable | isNotPropertyAvailable)*>
<!ATTLIST statement
id CDATA #REQUIRED
parameterMap CDATA #IMPLIED
parameterClass CDATA #IMPLIED
resultMap CDATA #IMPLIED
resultClass CDATA #IMPLIED
cacheModel CDATA #IMPLIED
resultSetType (FORWARD_ONLY | SCROLL_INSENSITIVE | SCROLL_SENSITIVE) #IMPLIED
fetchSize CDATA #IMPLIED
xmlResultName CDATA #IMPLIED
remapResults (true|false) #IMPLIED
timeout CDATA #IMPLIED
>

<!ELEMENT select (#PCDATA | include | dynamic | iterate | isParameterPresent | isNotParameterPresent | isEmpty | isNotEmpty | isNotNull | isNull | isNotEqual | isEqual | isGreaterThan | isGreaterEqual | isLessThan | isLessEqual | isPropertyAvailable | isNotPropertyAvailable)*>
<!ATTLIST select
id CDATA #REQUIRED
parameterMap CDATA #IMPLIED
parameterClass CDATA #IMPLIED
resultMap CDATA #IMPLIED
resultClass CDATA #IMPLIED
cacheModel CDATA #IMPLIED
resultSetType (FORWARD_ONLY | SCROLL_INSENSITIVE | SCROLL_SENSITIVE) #IMPLIED
fetchSize CDATA #IMPLIED
xmlResultName CDATA #IMPLIED
remapResults (true|false) #IMPLIED
timeout CDATA #IMPLIED
>

<!ELEMENT insert (#PCDATA | include | dynamic | selectKey | iterate | isParameterPresent | isNotParameterPresent | isEmpty | isNotEmpty | isNotNull | isNull | isNotEqual | isEqual | isGreaterThan | isGreaterEqual | isLessThan | isLessEqual | isPropertyAvailable | isNotPropertyAvailable)*>
<!ATTLIST insert
id CDATA #REQUIRED
parameterMap CDATA #IMPLIED
parameterClass CDATA #IMPLIED
timeout CDATA #IMPLIED
>

<!ELEMENT selectKey (#PCDATA | include)*>
<!ATTLIST selectKey
resultClass CDATA #IMPLIED
keyProperty CDATA #IMPLIED
type (pre|post) #IMPLIED
>

<!ELEMENT update (#PCDATA | include | dynamic | iterate | isParameterPresent | isNotParameterPresent | isEmpty | isNotEmpty | isNotNull | isNull | isNotEqual | isEqual | isGreaterThan | isGreaterEqual | isLessThan | isLessEqual | isPropertyAvailable | isNotPropertyAvailable)*>
<!ATTLIST update
id CDATA #REQUIRED
parameterMap CDATA #IMPLIED
parameterClass CDATA #IMPLIED
timeout CDATA #IMPLIED
>

<!ELEMENT delete (#PCDATA | include | dynamic | iterate | isParameterPresent | isNotParameterPresent | isEmpty | isNotEmpty | isNotNull | isNull | isNotEqual | isEqual | isGreaterThan | isGreaterEqual | isLessThan | isLessEqual | isPropertyAvailable | isNotPropertyAvailable)*>
<!ATTLIST delete
id CDATA #REQUIRED
parameterMap CDATA #IMPLIED
parameterClass CDATA #IMPLIED
timeout CDATA #IMPLIED
>

<!ELEMENT procedure (#PCDATA | include | dynamic | iterate | isParameterPresent | isNotParameterPresent | isEmpty | isNotEmpty | isNotNull | isNull | isNotEqual | isEqual | isGreaterThan | isGreaterEqual | isLessThan | isLessEqual | isPropertyAvailable | isNotPropertyAvailable)*>
<!ATTLIST procedure
id CDATA #REQUIRED
parameterMap CDATA #IMPLIED
parameterClass CDATA #IMPLIED
resultMap CDATA #IMPLIED
resultClass CDATA #IMPLIED
cacheModel CDATA #IMPLIED
fetchSize CDATA #IMPLIED
xmlResultName CDATA #IMPLIED
remapResults (true|false) #IMPLIED
timeout CDATA #IMPLIED
>

<!-- - - - - - - - - - - - - - - - - - - - - - - - -
                 DYNAMIC ELEMENTS
  - - - - - - - - - - - - - - - - - - - - - - - - -->

<!ELEMENT dynamic (#PCDATA | include | iterate | isParameterPresent | isNotParameterPresent | isEmpty | isNotEmpty | isNotNull | isNull | isNotEqual | isEqual | isGreaterThan | isGreaterEqual | isLessThan | isLessEqual | isPropertyAvailable | isNotPropertyAvailable)*>
<!ATTLIST dynamic
prepend CDATA #IMPLIED
open CDATA #IMPLIED
close CDATA #IMPLIED
>

<!ELEMENT isNotNull (#PCDATA | include | iterate | isParameterPresent | isNotParameterPresent | isEmpty | isNotEmpty | isNotNull | isNull | isNotEqual | isEqual | isGreaterThan | isGreaterEqual | isLessThan | isLessEqual | isPropertyAvailable | isNotPropertyAvailable)*>
<!ATTLIST isNotNull
prepend CDATA #IMPLIED
open CDATA #IMPLIED
close CDATA #IMPLIED
property CDATA #IMPLIED
removeFirstPrepend (true|false) #IMPLIED
>

<!ELEMENT isNull (#PCDATA | include | iterate | isParameterPresent | isNotParameterPresent | isEmpty | isNotEmpty | isNotNull | isNull | isNotEqual | isEqual | isGreaterThan | isGreaterEqual | isLessThan | isLessEqual | isPropertyAvailable | isNotPropertyAvailable)*>
<!ATTLIST isNull
prepend CDATA #IMPLIED
open CDATA #IMPLIED
close CDATA #IMPLIED
property CDATA #IMPLIED
removeFirstPrepend (true|false) #IMPLIED
>

<!ELEMENT isNotPropertyAvailable (#PCDATA | include | iterate | isParameterPresent | isNotParameterPresent | isEmpty | isNotEmpty | isNotNull | isNull | isNotEqual | isEqual | isGreaterThan | isGreaterEqual | isLessThan | isLessEqual | isPropertyAvailable | isNotPropertyAvailable)*>
<!ATTLIST isNotPropertyAvailable
prepend CDATA #IMPLIED
open CDATA #IMPLIED
close CDATA #IMPLIED
property CDATA #REQUIRED
removeFirstPrepend (true|false) #IMPLIED
>

<!ELEMENT isPropertyAvailable (#PCDATA | include | iterate | isParameterPresent | isNotParameterPresent | isEmpty | isNotEmpty | isNotNull | isNull | isNotEqual | isEqual | isGreaterThan | isGreaterEqual | isLessThan | isLessEqual | isPropertyAvailable | isNotPropertyAvailable)*>
<!ATTLIST isPropertyAvailable
prepend CDATA #IMPLIED
open CDATA #IMPLIED
close CDATA #IMPLIED
property CDATA #REQUIRED
removeFirstPrepend (true|false) #IMPLIED
>

<!ELEMENT isEqual (#PCDATA | include | iterate | isParameterPresent | isNotParameterPresent | isEmpty | isNotEmpty | isNotNull | isNull | isNotEqual | isEqual | isGreaterThan | isGreaterEqual | isLessThan | isLessEqual | isPropertyAvailable | isNotPropertyAvailable)*>
<!ATTLIST isEqual
prepend CDATA #IMPLIED
open CDATA #IMPLIED
close CDATA #IMPLIED
property CDATA #IMPLIED
removeFirstPrepend (true|false) #IMPLIED
compareProperty CDATA #IMPLIED
compareValue CDATA #IMPLIED
>

<!ELEMENT isNotEqual (#PCDATA | include | iterate | isParameterPresent | isNotParameterPresent | isEmpty | isNotEmpty | isNotNull | isNull | isNotEqual | isEqual | isGreaterThan | isGreaterEqual | isLessThan | isLessEqual | isPropertyAvailable | isNotPropertyAvailable)*>
<!ATTLIST isNotEqual
prepend CDATA #IMPLIED
open CDATA #IMPLIED
close CDATA #IMPLIED
property CDATA #IMPLIED
removeFirstPrepend (true|false) #IMPLIED
compareProperty CDATA #IMPLIED
compareValue CDATA #IMPLIED
>

<!ELEMENT isGreaterThan (#PCDATA | include | iterate | isParameterPresent | isNotParameterPresent | isEmpty | isNotEmpty | isNotNull | isNull | isNotEqual | isEqual | isGreaterThan | isGreaterEqual | isLessThan | isLessEqual | isPropertyAvailable | isNotPropertyAvailable)*>
<!ATTLIST isGreaterThan
prepend CDATA #IMPLIED
open CDATA #IMPLIED
close CDATA #IMPLIED
property CDATA #IMPLIED
removeFirstPrepend (true|false) #IMPLIED
compareProperty CDATA #IMPLIED
compareValue CDATA #IMPLIED
>

<!ELEMENT isGreaterEqual (#PCDATA | include | iterate | isParameterPresent | isNotParameterPresent | isEmpty | isNotEmpty | isNotNull | isNull | isNotEqual | isEqual | isGreaterThan | isGreaterEqual | isLessThan | isLessEqual | isPropertyAvailable | isNotPropertyAvailable)*>
<!ATTLIST isGreaterEqual
prepend CDATA #IMPLIED
open CDATA #IMPLIED
close CDATA #IMPLIED
property CDATA #IMPLIED
removeFirstPrepend (true|false) #IMPLIED
compareProperty CDATA #IMPLIED
compareValue CDATA #IMPLIED
>

<!ELEMENT isLessThan (#PCDATA | include | iterate | isParameterPresent | isNotParameterPresent | isEmpty | isNotEmpty | isNotNull | isNull | isNotEqual | isEqual | isGreaterThan | isGreaterEqual | isLessThan | isLessEqual | isPropertyAvailable | isNotPropertyAvailable)*>
<!ATTLIST isLessThan
prepend CDATA #IMPLIED
open CDATA #IMPLIED
close CDATA #IMPLIED
property CDATA #IMPLIED
removeFirstPrepend (true|false) #IMPLIED
compareProperty CDATA #IMPLIED
compareValue CDATA #IMPLIED
>

<!ELEMENT isLessEqual (#PCDATA | include | iterate | isParameterPresent | isNotParameterPresent | isEmpty | isNotEmpty | isNotNull | isNull | isNotEqual | isEqual | isGreaterThan | isGreaterEqual | isLessThan | isLessEqual | isPropertyAvailable | isNotPropertyAvailable)*>
<!ATTLIST isLessEqual
prepend CDATA #IMPLIED
open CDATA #IMPLIED
close CDATA #IMPLIED
property CDATA #IMPLIED
removeFirstPrepend (true|false) #IMPLIED
compareProperty CDATA #IMPLIED
compareValue CDATA #IMPLIED
>

<!ELEMENT isEmpty (#PCDATA | include | iterate | isParameterPresent | isNotParameterPresent | isEmpty | isNotEmpty | isNotNull | isNull | isNotEqual | isEqual | isGreaterThan | isGreaterEqual | isLessThan | isLessEqual | isPropertyAvailable | isNotPropertyAvailable)*>
<!ATTLIST isEmpty
prepend CDATA #IMPLIED
open CDATA #IMPLIED
close CDATA #IMPLIED
property CDATA #IMPLIED
removeFirstPrepend (true|false) #IMPLIED
>

<!ELEMENT isNotEmpty (#PCDATA | include | iterate | isParameterPresent | isNotParameterPresent | isEmpty | isNotEmpty | isNotNull | isNull | isNotEqual | isEqual | isGreaterThan | isGreaterEqual | isLessThan | isLessEqual | isPropertyAvailable | isNotPropertyAvailable)*>
<!ATTLIST isNotEmpty
prepend CDATA #IMPLIED
open CDATA #IMPLIED
close CDATA #IMPLIED
property CDATA #IMPLIED
removeFirstPrepend (true|false) #IMPLIED
>

<!ELEMENT isParameterPresent (#PCDATA | include | iterate | isParameterPresent | isNotParameterPresent | isEmpty | isNotEmpty | isNotNull | isNull | isNotEqual | isEqual | isGreaterThan | isGreaterEqual | isLessThan | isLessEqual | isPropertyAvailable | isNotPropertyAvailable)*>
<!ATTLIST isParameterPresent
prepend CDATA #IMPLIED
open CDATA #IMPLIED
close CDATA #IMPLIED
removeFirstPrepend (true|false) #IMPLIED
>

<!ELEMENT isNotParameterPresent (#PCDATA | include | iterate | isParameterPresent | isNotParameterPresent | isEmpty | isNotEmpty | isNotNull | isNull | isNotEqual | isEqual | isGreaterThan | isGreaterEqual | isLessThan | isLessEqual | isPropertyAvailable | isNotPropertyAvailable)*>
<!ATTLIST isNotParameterPresent
prepend CDATA #IMPLIED
open CDATA #IMPLIED
close CDATA #IMPLIED
removeFirstPrepend (true|false) #IMPLIED
>

<!ELEMENT iterate (#PCDATA | include | iterate | isParameterPresent | isNotParameterPresent | isEmpty | isNotEmpty | isNotNull | isNull | isNotEqual | isEqual | isGreaterThan | isGreaterEqual | isLessThan | isLessEqual | isPropertyAvailable | isNotPropertyAvailable)*>
<!ATTLIST iterate
prepend CDATA #IMPLIED
property CDATA #IMPLIED
removeFirstPrepend (true|false|iterate) #IMPLIED
open CDATA #IMPLIED
close CDATA #IMPLIED
conjunction CDATA #IMPLIED
>
