<?xml version="1.0" encoding="UTF-8"?>
<!DOCTYPE sqlMap PUBLIC "-//ibatis.apache.org//DTD SQL Map 2.0//EN" "http://ibatis.apache.org/dtd/sql-map-2.dtd">
<sqlMap namespace="ResultObjectFactoryStatements">

  <resultMap id="itemResultROF" class="com.testdomain.IItem">
    <result column="itemid" property="itemId"/>
    <result column="productid" property="productId"/>
    <result column="listprice" property="listPrice"/>
    <result column="unitcost" property="unitCost"/>
    <result column="status" property="status"/>
    <result column="attr1" property="attribute1"/>
    <result column="attr2" property="attribute2"/>
    <result column="attr3" property="attribute3"/>
    <result column="attr4" property="attribute4"/>
    <result column="attr5" property="attribute5"/>
    <result column="{supplierId=supplier}" property="supplier" select="getSupplierByIdROF"/>
  </resultMap>

  <resultMap id="supplierResultROF" class="com.testdomain.ISupplier">
    <result column="suppid" property="supplierId"/>
    <result column="name" property="name"/>
    <result column="status" property="status"/>
    <result column="addr1" property="addressLine1"/>
    <result column="addr2" property="addressLine1"/>
    <result column="city" property="city"/>
    <result column="state" property="state"/>
    <result column="zip" property="zip"/>
    <result column="phone" property="phone"/>
  </resultMap>

  <select id="getAllItemsROF" resultMap="itemResultROF">
    select *
    from item
  </select>

  <select id="getSupplierByIdROF" resultMap="supplierResultROF" parameterClass="com.testdomain.ISupplierKey">
    select *
    from supplier
    where suppid = #supplierId#
  </select>
</sqlMap>
