<?xml version="1.0" encoding="UTF-8" ?>
<!--

       Copyright 2009-2012 the original author or authors.

       Licensed under the Apache License, Version 2.0 (the "License");
       you may not use this file except in compliance with the License.
       You may obtain a copy of the License at

          http://www.apache.org/licenses/LICENSE-2.0

       Unless required by applicable law or agreed to in writing, software
       distributed under the License is distributed on an "AS IS" BASIS,
       WITHOUT WARRANTIES OR CONDITIONS OF ANY KIND, either express or implied.
       See the License for the specific language governing permissions and
       limitations under the License.

-->

<!DOCTYPE sqlMap
    PUBLIC "-//ibatis.apache.org//DTD SQL Map 2.0//EN"
    "http://ibatis.apache.org/dtd/sql-map-2.dtd">

<sqlMap>

  <resultMap id="categoryResultMap" class="com.testdomain.Category" groupBy="categoryId">
    <result property="categoryId" column="catid"/>
    <result property="name" column="catname"/>
    <result property="description" column="catdescn"/>
    <result property="productList" resultMap="productResultMap"/>
    <result property="itemList" resultMap="itemResultMap"/>
  </resultMap>


  <resultMap id="productResultMap" class="com.testdomain.Product">
    <result property="productId" column="productid"/>
    <result property="categoryId" column="category"/>
    <result property="name" column="prodname"/>
    <result property="description" column="proddescn"/>
  </resultMap>

  <resultMap id="itemResultMap" class="com.testdomain.Item">
    <result property="itemId" column="itemid"/>
    <result property="productId" column="productid"/>
    <result property="listPrice" column="listprice"/>
    <result property="unitCost" column="unitcost"/>
    <result property="supplierId" column="supplier"/>
    <result property="status" column="status"/>
    <result property="attribute1" column="attr1"/>
    <result property="quantity" column="qty"/>
  </resultMap>

  <select id="getAllCategoriesMap" resultMap="categoryResultMap">
    select
    c.catid, c.name as catname, c.descn as catdescn,
    p.productid, p.category, p.name as prodname,
    p.descn as proddescn, i.itemid, i.productid,
    i.listprice, i.unitcost, i.supplier, i.status,
    i.attr1, i.attr2, i.attr3, i.attr4, i.attr5,
    v.itemid, v.qty
    from category c, product p, item i, inventory v
    where c.catid = p.category
    and p.productid = i.productid
    and i.itemid = v.itemid
  </select>

</sqlMap>
